Name,Subclass,Url,Division,Retailer
My Kouzina Farina Flour 500g,Flours and other cereals,https://wolt.com/el/cyp/larnaca/venue/metro-larnaca/my-kouzina-farina-flour-500g-itemid-c4ff86190762850cb0efe1f9?search=My+Kouzina+Farina+Flour+500g,FOOD AND NON-ALCOHOLIC BEVERAGES,METRO
Sun Baby Potatoes 750g,Potatoes,https://wolt.com/el/cyp/larnaca/venue/metro-larnaca/sun-baby-potatoes-750g-itemid-0bde77389692b6ba00cb0e17?search=Potatoes+Baby,FOOD AND NON-ALCOHOLIC BEVERAGES,METRO
Paradisiotis Chicken Breast,Poultry,https://wolt.com/el/cyp/larnaca/venue/metro-larnaca/paradisiotis-chicken-breast-itemid-b0a215a6d211fa427d48f991,FOOD AND NON-ALCOHOLIC BEVERAGES,METRO
Pork Sheftalia,Other meats,https://wolt.com/el/cyp/larnaca/venue/metro-larnaca/pork-sheftalia-itemid-9c57d2d18c300ace8ab3d855?search=pork+sheftalia,FOOD AND NON-ALCOHOLIC BEVERAGES,METRO
Septona Cotton Buds Sticks Biodegradable X100,"Articles for personal hygiene and wellness, esoteric products and beauty products",https://wolt.com/el/cyp/larnaca/venue/metro-larnaca/septona-cotton-buds-sticks-biodegradable-x100-itemid-4480660fdb426e6297a266aa?search=Septona+Cotton+Buds+Sticks+Biodegradable+X100,MISCELLANEOUS GOODS AND SERVICES,METRO
